{
  "schema_version": "unirouter.source-evidence.source-scope.v1",
  "product": "unirouter",
  "source_instance": "unirouter-development-seq8",
  "identity_authority": "neutral_campaign_authorization",
  "runtime_observation": "not_claimed",
  "feed_snapshot_schema": "unirouter.completed-execution.v1"
}
